{
  "$schema": "http://json-schema.org/draft-07/schema",
  "$id": "deployment_review$requested",
  "type": "object",
  "required": [
    "action",
    "environment",
    "workflow_run",
    "since",
    "workflow_job_run",
    "reviewers",
    "requestor",
    "repository",
    "organization",
    "sender"
  ],
  "properties": {
    "action": { "type": "string", "enum": ["requested"] },
    "workflow_run": {
      "oneOf": [
        { "$ref": "common/workflow-run.schema.json" },
        { "type": "null" }
      ]
    },
    "since": { "type": "string", "format": "date-time" },
    "workflow_job_run": {
      "type": "object",
      "required": [
        "id",
        "name",
        "status",
        "conclusion",
        "html_url",
        "created_at",
        "updated_at",
        "environment"
      ],
      "properties": {
        "id": { "type": "integer" },
        "name": { "type": "string" },
        "status": {
          "type": "string",
          "enum": ["queued", "in_progress", "completed", "waiting"]
        },
        "conclusion": {
          "type": ["string", "null"],
          "enum": ["success", "failure", "cancelled", "skipped", null]
        },
        "html_url": { "type": "string", "format": "uri" },
        "created_at": { "type": "string", "format": "date-time" },
        "updated_at": { "type": "string", "format": "date-time" },
        "environment": { "type": "string" }
      },
      "additionalProperties": false
    },
    "environment": { "type": "string" },
    "reviewers": {
      "type": "array",
      "items": {
        "oneOf": [
          {
            "type": "object",
            "required": ["type", "reviewer"],
            "properties": {
              "type": { "type": "string", "enum": ["User"] },
              "reviewer": { "$ref": "common/user.schema.json" }
            },
            "additionalProperties": false
          },
          {
            "type": "object",
            "required": ["type", "reviewer"],
            "properties": {
              "type": { "type": "string", "enum": ["Team"] },
              "reviewer": { "$ref": "common/team.schema.json" }
            },
            "additionalProperties": false
          }
        ]
      }
    },
    "requestor": { "$ref": "common/user.schema.json" },
    "repository": { "$ref": "common/repository.schema.json" },
    "organization": { "$ref": "common/organization.schema.json" },
    "sender": { "$ref": "common/user.schema.json" },
    "installation": { "$ref": "common/installation-lite.schema.json" }
  },
  "additionalProperties": false,
  "title": "deployment_review requested event"
}
